{
  "$schema": "https://smartnutri.org/schemas/standards",
  "version": "1.0.0",
  "description": "Dietary Reference Intakes — RDA & UL theo IOM. Trẻ sơ sinh <1 tuổi dùng AI riêng, không nằm trong bảng này.",
  "source": "Institute of Medicine. Dietary Reference Intakes. National Academies Press.",
  "legend": {
    "RDA": "Recommended Dietary Allowance — lượng đủ cho 97–98% người khỏe mạnh",
    "AI":  "Adequate Intake — dùng khi chưa đủ dữ liệu thiết lập RDA",
    "UL":  "Tolerable Upper Intake Level — ngưỡng tối đa an toàn",
    "null": "Chưa xác định hoặc không áp dụng"
  },
  "age_groups": [
    "AG_CHILD_1_3Y",
    "AG_CHILD_4_8Y",
    "AG_CHILD_9_13Y",
    "AG_TEEN_14_18Y_M",
    "AG_TEEN_14_18Y_F",
    "AG_ADULT_19_30Y_M",
    "AG_ADULT_19_30Y_F",
    "AG_ADULT_31_50Y_M",
    "AG_ADULT_31_50Y_F",
    "AG_ADULT_51_70Y_M",
    "AG_ADULT_51_70Y_F",
    "AG_ELDER_70Y_M",
    "AG_ELDER_70Y_F",
    "AG_PREGNANT",
    "AG_LACTATING"
  ],
  "nutrients": {
    "energy": {
      "NUT_energy": {
        "unit": "kcal/day",
        "type": "EER",
        "note": "Estimated Energy Requirement — tính theo cân nặng, chiều cao, mức hoạt động. Không có UL.",
        "values": "Xem bảng EER riêng"
      }
    },
    "macronutrients": {
      "NUT_carbohydrate_total": { "unit": "g/day", "type": "RDA", "ul": null,
        "values": { "AG_CHILD_1_3Y": 130, "AG_CHILD_4_8Y": 130, "AG_CHILD_9_13Y": 130,
          "AG_TEEN_14_18Y_M": 130, "AG_TEEN_14_18Y_F": 130,
          "AG_ADULT_19_30Y_M": 130, "AG_ADULT_19_30Y_F": 130,
          "AG_ADULT_31_50Y_M": 130, "AG_ADULT_31_50Y_F": 130,
          "AG_ADULT_51_70Y_M": 130, "AG_ADULT_51_70Y_F": 130,
          "AG_ELDER_70Y_M": 130, "AG_ELDER_70Y_F": 130,
          "AG_PREGNANT": 175, "AG_LACTATING": 210 }},
      "NUT_fiber": { "unit": "g/day", "type": "AI", "ul": null,
        "values": { "AG_CHILD_1_3Y": 19, "AG_CHILD_4_8Y": 25, "AG_CHILD_9_13Y": 26,
          "AG_TEEN_14_18Y_M": 38, "AG_TEEN_14_18Y_F": 26,
          "AG_ADULT_19_30Y_M": 38, "AG_ADULT_19_30Y_F": 25,
          "AG_ADULT_31_50Y_M": 38, "AG_ADULT_31_50Y_F": 25,
          "AG_ADULT_51_70Y_M": 30, "AG_ADULT_51_70Y_F": 21,
          "AG_ELDER_70Y_M": 30, "AG_ELDER_70Y_F": 21,
          "AG_PREGNANT": 28, "AG_LACTATING": 29 }},
      "NUT_protein": { "unit": "g/day", "type": "RDA", "ul": null,
        "values": { "AG_CHILD_1_3Y": 13, "AG_CHILD_4_8Y": 19, "AG_CHILD_9_13Y": 34,
          "AG_TEEN_14_18Y_M": 52, "AG_TEEN_14_18Y_F": 46,
          "AG_ADULT_19_30Y_M": 56, "AG_ADULT_19_30Y_F": 46,
          "AG_ADULT_31_50Y_M": 56, "AG_ADULT_31_50Y_F": 46,
          "AG_ADULT_51_70Y_M": 56, "AG_ADULT_51_70Y_F": 46,
          "AG_ELDER_70Y_M": 56, "AG_ELDER_70Y_F": 46,
          "AG_PREGNANT": 71, "AG_LACTATING": 71 }}
    },
    "vitamins": {
      "NUT_vitamin_a": { "unit": "μg RAE/day", "type": "RDA",
        "ul": { "unit": "μg/day", "note": "UL tính theo Preformed Vitamin A (Retinol)",
          "values": { "AG_CHILD_1_3Y": 600, "AG_CHILD_4_8Y": 900, "AG_CHILD_9_13Y": 1700,
            "AG_TEEN_14_18Y_M": 2800, "AG_TEEN_14_18Y_F": 2800,
            "AG_ADULT_19_30Y_M": 3000, "AG_ADULT_19_30Y_F": 3000,
            "AG_ADULT_31_50Y_M": 3000, "AG_ADULT_31_50Y_F": 3000,
            "AG_ADULT_51_70Y_M": 3000, "AG_ADULT_51_70Y_F": 3000,
            "AG_ELDER_70Y_M": 3000, "AG_ELDER_70Y_F": 3000,
            "AG_PREGNANT": 2800, "AG_LACTATING": 2800 }},
        "values": { "AG_CHILD_1_3Y": 300, "AG_CHILD_4_8Y": 400, "AG_CHILD_9_13Y": 600,
          "AG_TEEN_14_18Y_M": 900, "AG_TEEN_14_18Y_F": 700,
          "AG_ADULT_19_30Y_M": 900, "AG_ADULT_19_30Y_F": 700,
          "AG_ADULT_31_50Y_M": 900, "AG_ADULT_31_50Y_F": 700,
          "AG_ADULT_51_70Y_M": 900, "AG_ADULT_51_70Y_F": 700,
          "AG_ELDER_70Y_M": 900, "AG_ELDER_70Y_F": 700,
          "AG_PREGNANT": 770, "AG_LACTATING": 1300 }},
      "NUT_vitamin_d": { "unit": "μg/day", "type": "RDA",
        "ul": { "unit": "μg/day",
          "values": { "AG_CHILD_1_3Y": 63, "AG_CHILD_4_8Y": 75, "AG_CHILD_9_13Y": 100,
            "AG_TEEN_14_18Y_M": 100, "AG_TEEN_14_18Y_F": 100,
            "AG_ADULT_19_30Y_M": 100, "AG_ADULT_19_30Y_F": 100,
            "AG_ADULT_31_50Y_M": 100, "AG_ADULT_31_50Y_F": 100,
            "AG_ADULT_51_70Y_M": 100, "AG_ADULT_51_70Y_F": 100,
            "AG_ELDER_70Y_M": 100, "AG_ELDER_70Y_F": 100,
            "AG_PREGNANT": 100, "AG_LACTATING": 100 }},
        "values": { "AG_CHILD_1_3Y": 15, "AG_CHILD_4_8Y": 15, "AG_CHILD_9_13Y": 15,
          "AG_TEEN_14_18Y_M": 15, "AG_TEEN_14_18Y_F": 15,
          "AG_ADULT_19_30Y_M": 15, "AG_ADULT_19_30Y_F": 15,
          "AG_ADULT_31_50Y_M": 15, "AG_ADULT_31_50Y_F": 15,
          "AG_ADULT_51_70Y_M": 15, "AG_ADULT_51_70Y_F": 15,
          "AG_ELDER_70Y_M": 20, "AG_ELDER_70Y_F": 20,
          "AG_PREGNANT": 15, "AG_LACTATING": 15 }},
      "NUT_vitamin_e": { "unit": "mg/day", "type": "RDA",
        "ul": { "unit": "mg/day",
          "values": { "AG_CHILD_1_3Y": 200, "AG_CHILD_4_8Y": 300, "AG_CHILD_9_13Y": 600,
            "AG_TEEN_14_18Y_M": 800, "AG_TEEN_14_18Y_F": 800,
            "AG_ADULT_19_30Y_M": 1000, "AG_ADULT_19_30Y_F": 1000,
            "AG_ADULT_31_50Y_M": 1000, "AG_ADULT_31_50Y_F": 1000,
            "AG_ADULT_51_70Y_M": 1000, "AG_ADULT_51_70Y_F": 1000,
            "AG_ELDER_70Y_M": 1000, "AG_ELDER_70Y_F": 1000,
            "AG_PREGNANT": 800, "AG_LACTATING": 800 }},
        "values": { "AG_CHILD_1_3Y": 6, "AG_CHILD_4_8Y": 7, "AG_CHILD_9_13Y": 11,
          "AG_TEEN_14_18Y_M": 15, "AG_TEEN_14_18Y_F": 15,
          "AG_ADULT_19_30Y_M": 15, "AG_ADULT_19_30Y_F": 15,
          "AG_ADULT_31_50Y_M": 15, "AG_ADULT_31_50Y_F": 15,
          "AG_ADULT_51_70Y_M": 15, "AG_ADULT_51_70Y_F": 15,
          "AG_ELDER_70Y_M": 15, "AG_ELDER_70Y_F": 15,
          "AG_PREGNANT": 15, "AG_LACTATING": 19 }},
      "NUT_vitamin_k": { "unit": "μg/day", "type": "AI", "ul": null,
        "ul_note": "Chưa xác định UL cho Vitamin K từ thực phẩm",
        "values": { "AG_CHILD_1_3Y": 30, "AG_CHILD_4_8Y": 55, "AG_CHILD_9_13Y": 60,
          "AG_TEEN_14_18Y_M": 75, "AG_TEEN_14_18Y_F": 75,
          "AG_ADULT_19_30Y_M": 120, "AG_ADULT_19_30Y_F": 90,
          "AG_ADULT_31_50Y_M": 120, "AG_ADULT_31_50Y_F": 90,
          "AG_ADULT_51_70Y_M": 120, "AG_ADULT_51_70Y_F": 90,
          "AG_ELDER_70Y_M": 120, "AG_ELDER_70Y_F": 90,
          "AG_PREGNANT": 90, "AG_LACTATING": 90 }},
      "NUT_vitamin_c": { "unit": "mg/day", "type": "RDA",
        "ul": { "unit": "mg/day",
          "values": { "AG_CHILD_1_3Y": 400, "AG_CHILD_4_8Y": 650, "AG_CHILD_9_13Y": 1200,
            "AG_TEEN_14_18Y_M": 1800, "AG_TEEN_14_18Y_F": 1800,
            "AG_ADULT_19_30Y_M": 2000, "AG_ADULT_19_30Y_F": 2000,
            "AG_ADULT_31_50Y_M": 2000, "AG_ADULT_31_50Y_F": 2000,
            "AG_ADULT_51_70Y_M": 2000, "AG_ADULT_51_70Y_F": 2000,
            "AG_ELDER_70Y_M": 2000, "AG_ELDER_70Y_F": 2000,
            "AG_PREGNANT": 1800, "AG_LACTATING": 1800 }},
        "values": { "AG_CHILD_1_3Y": 15, "AG_CHILD_4_8Y": 25, "AG_CHILD_9_13Y": 45,
          "AG_TEEN_14_18Y_M": 75, "AG_TEEN_14_18Y_F": 65,
          "AG_ADULT_19_30Y_M": 90, "AG_ADULT_19_30Y_F": 75,
          "AG_ADULT_31_50Y_M": 90, "AG_ADULT_31_50Y_F": 75,
          "AG_ADULT_51_70Y_M": 90, "AG_ADULT_51_70Y_F": 75,
          "AG_ELDER_70Y_M": 90, "AG_ELDER_70Y_F": 75,
          "AG_PREGNANT": 85, "AG_LACTATING": 120 }},
      "NUT_vitamin_b1": { "unit": "mg/day", "type": "RDA", "ul": null,
        "values": { "AG_CHILD_1_3Y": 0.5, "AG_CHILD_4_8Y": 0.6, "AG_CHILD_9_13Y": 0.9,
          "AG_TEEN_14_18Y_M": 1.2, "AG_TEEN_14_18Y_F": 1.0,
          "AG_ADULT_19_30Y_M": 1.2, "AG_ADULT_19_30Y_F": 1.1,
          "AG_ADULT_31_50Y_M": 1.2, "AG_ADULT_31_50Y_F": 1.1,
          "AG_ADULT_51_70Y_M": 1.2, "AG_ADULT_51_70Y_F": 1.1,
          "AG_ELDER_70Y_M": 1.2, "AG_ELDER_70Y_F": 1.1,
          "AG_PREGNANT": 1.4, "AG_LACTATING": 1.4 }},
      "NUT_vitamin_b2": { "unit": "mg/day", "type": "RDA", "ul": null,
        "values": { "AG_CHILD_1_3Y": 0.5, "AG_CHILD_4_8Y": 0.6, "AG_CHILD_9_13Y": 0.9,
          "AG_TEEN_14_18Y_M": 1.3, "AG_TEEN_14_18Y_F": 1.0,
          "AG_ADULT_19_30Y_M": 1.3, "AG_ADULT_19_30Y_F": 1.1,
          "AG_ADULT_31_50Y_M": 1.3, "AG_ADULT_31_50Y_F": 1.1,
          "AG_ADULT_51_70Y_M": 1.3, "AG_ADULT_51_70Y_F": 1.1,
          "AG_ELDER_70Y_M": 1.3, "AG_ELDER_70Y_F": 1.1,
          "AG_PREGNANT": 1.4, "AG_LACTATING": 1.6 }},
      "NUT_vitamin_b3": { "unit": "mg NE/day", "type": "RDA",
        "ul": { "unit": "mg/day", "note": "UL tính theo Niacin tổng hợp (không áp dụng cho Niacin từ thực phẩm)",
          "values": { "AG_CHILD_1_3Y": 10, "AG_CHILD_4_8Y": 15, "AG_CHILD_9_13Y": 20,
            "AG_TEEN_14_18Y_M": 30, "AG_TEEN_14_18Y_F": 30,
            "AG_ADULT_19_30Y_M": 35, "AG_ADULT_19_30Y_F": 35,
            "AG_ADULT_31_50Y_M": 35, "AG_ADULT_31_50Y_F": 35,
            "AG_ADULT_51_70Y_M": 35, "AG_ADULT_51_70Y_F": 35,
            "AG_ELDER_70Y_M": 35, "AG_ELDER_70Y_F": 35,
            "AG_PREGNANT": 30, "AG_LACTATING": 30 }},
        "values": { "AG_CHILD_1_3Y": 6, "AG_CHILD_4_8Y": 8, "AG_CHILD_9_13Y": 12,
          "AG_TEEN_14_18Y_M": 16, "AG_TEEN_14_18Y_F": 14,
          "AG_ADULT_19_30Y_M": 16, "AG_ADULT_19_30Y_F": 14,
          "AG_ADULT_31_50Y_M": 16, "AG_ADULT_31_50Y_F": 14,
          "AG_ADULT_51_70Y_M": 16, "AG_ADULT_51_70Y_F": 14,
          "AG_ELDER_70Y_M": 16, "AG_ELDER_70Y_F": 14,
          "AG_PREGNANT": 18, "AG_LACTATING": 17 }},
      "NUT_vitamin_b4": { "unit": "mg/day", "type": "AI",
        "ul": { "unit": "mg/day",
          "values": { "AG_CHILD_1_3Y": 1000, "AG_CHILD_4_8Y": 1000, "AG_CHILD_9_13Y": 2000,
            "AG_TEEN_14_18Y_M": 3000, "AG_TEEN_14_18Y_F": 3000,
            "AG_ADULT_19_30Y_M": 3500, "AG_ADULT_19_30Y_F": 3500,
            "AG_ADULT_31_50Y_M": 3500, "AG_ADULT_31_50Y_F": 3500,
            "AG_ADULT_51_70Y_M": 3500, "AG_ADULT_51_70Y_F": 3500,
            "AG_ELDER_70Y_M": 3500, "AG_ELDER_70Y_F": 3500,
            "AG_PREGNANT": 3000, "AG_LACTATING": 3500 }},